{
  "id": "ai-finance/unit-economics-pricing",
  "course": "ai-finance",
  "order": 42,
  "title": {
    "ko": "가격·유닛 이코노믹스 — 정말 남는지 계산하기"
  },
  "summary": {
    "ko": "매출이 아니라 '한 건 팔 때 진짜 얼마가 남는가'(유닛 이코노믹스)를 계산해 가격을 정하는 법을 익힌다 — 원가·수수료·AI 사용료·환불·고객획득비를 빼고 남는 마진. AI로 시나리오 계산을 빠르게 돌리되, 숫자의 가정과 결론은 사람이 검증한다. 가치 기반 가격과 '싸게 많이 팔다 망하는' 함정을 구분한다."
  },
  "objectives": [
    {
      "ko": "내 상품/서비스 '한 건'의 진짜 마진(원가·수수료·AI 사용료·환불·고객획득비를 뺀)을 계산하고, AI로 가격 시나리오를 비교하되 가정·결론은 사람이 검증해, 가치 기반의 새 가격과 '안 남는 구조'를 고치는 한 장 계산표를 완성한다."
    }
  ],
  "body": {
    "ko": "> '월 매출 500만원'이 적자일 수도 있다. 중요한 건 매출이 아니라 '한 건 팔 때 진짜 얼마 남나'다. 오늘 내 상품의 유닛 이코노믹스를 계산하고 가격을 다시 정한다.\n\n## 이 레슨에서 만드는 것\n\n내 상품/서비스 '한 건'의 진짜 마진(원가·수수료·AI 사용료·환불·고객획득비를 뺀)을 계산하고, AI로 가격 시나리오를 비교하되 가정·결론은 사람이 검증해, 가치 기반의 새 가격과 '안 남는 구조'를 고치는 한 장 계산표를 완성한다.\n\n## 핵심 개념\n\n'유닛 이코노믹스'는 '한 단위(한 건/한 고객)를 팔 때 실제로 얼마가 남는가'다. 초보가 가장 자주 망하는 이유가 여기 있다: 매출만 보고 '잘 된다' 착각하다, 빼야 할 비용을 다 빼면 적자인 경우. 한 건의 진짜 마진 = 가격 −(직접 원가 + 결제·플랫폼 수수료 + AI/도구 사용료 + 환불·재작업 비용 + 그 고객을 데려온 비용(광고·시간)). 이 중 초보가 잘 빼먹는 게 '수수료'(플랫폼·결제)와 '고객획득비(CAC)'와 '내 시간'이다. AI는 여러 가격·비용 시나리오를 빠르게 비교 계산하는 데 강하다 — 하지만 '가정'(환불률·전환율·시간 가치)을 사람이 현실적으로 넣고, 결과를 검산해야 한다. AI가 낙관적 가정을 깔면 숫자는 예뻐도 현실은 적자다. 핵심 통찰: 가격은 '원가+얼마'가 아니라 '고객이 얻는 가치'로 정하되, 유닛 이코노믹스로 '최소 남아야 하는 선'을 지킨다. '싸게 많이 팔면 된다'는 함정이다 — 마진이 0 이하면 많이 팔수록 더 망한다.\n\n### 왜 작동하는가\n\nAI는 수많은 사업 계산 사례를 학습해서, 복잡한 비용·가격 시나리오를 순식간에 표로 정리해줍니다. 그래서 당신은 '현실적인 가정'(환불률, 시간 가치, 획득비)만 정확히 넣으면, 계산과 비교는 AI가 대신 해줍니다. 다만 AI가 슬쩍 깔아둔 낙관적 가정은 당신이 반드시 검산해야 진짜 마진이 보입니다.\n\n## 👀 따라하기 예시\n\n온라인으로 9,900원짜리 디지털 클래스를 파는 상황. 매출은 매달 늘고 있는데 통장 잔고는 안 늘어요. 제가 먼저 이 상품의 진짜 유닛 이코노믹스를 계산해볼게요, 눈으로 따라오세요.\n\n### 1. ① AI에게 비용 항목부터 빠짐없이 뽑아달라고 요청\n\n**실제 결과**\n\n```text\n\"이 상품(9,900원 디지털 클래스, 결제대행 3%, 플랫폼 수수료 8%)의 판매 1건당 비용 항목을 전부 나열해줘. 수수료, 도구비, 환불, 광고비, 내 시간까지 빼먹지 말고.\" → AI 응답: \"① 결제수수료 297원 ② 플랫폼수수료 792원 ③ AI도구 월정액 안분 500원 ④ 환불추정(3%) 297원 ⑤ 광고로 1명 데려오는 비용(CAC) 2,000원 ⑤ 미포함: 본인 제작 시간\"\n```\n\n> AI는 항목을 빠짐없이 나열하는 데 강하지만, '내 시간'처럼 눈에 안 보이는 비용은 프롬프트에 콕 집어 요구해야 빠뜨리지 않습니다.\n\n### 2. ② 가정을 사람이 보수적으로 수정해서 재계산 요청\n\n**실제 결과**\n\n```text\n\"환불률을 AI 추정 3%가 아니라 5%로, CAC도 2,000원이 아니라 2,500원(광고 효율이 나빠질 걸 대비)으로 올려서 다시 계산해줘.\" → AI 응답: \"9,900 −(297+792+500+495+2,500) = 한 건 마진 5,316원 (기존 계산 6,014원보다 700원 낮음)\"\n```\n\n> AI의 기본 가정은 늘 좀 낙관적입니다. 보수적으로 한 번 더 돌려보면 '진짜 안전선'이 보입니다 — 이게 아하 포인트예요.\n\n### 3. ③ 손익분기 가격과 최소 마진 기준선 요청\n\n**실제 결과**\n\n```text\n\"마진이 0이 되는 손익분기 가격은? 그리고 내 시간값 고려해서 최소 얼마는 남아야 '할 만한 장사'인지 계산해줘.\" → AI 응답: \"손익분기 약 4,084원. 제작·응대에 드는 시간을 시급 15,000원으로 잡으면, 건당 최소 5,000원은 남아야 함 → 바닥가 9,084원선\"\n```\n\n> '더는 안 내리는 바닥선'을 숫자로 못박아두면, 나중에 할인 압박이 와도 흔들리지 않습니다.\n\n### 4. ④ 가격 인상 vs 번들 시나리오 비교 요청\n\n**실제 결과**\n\n```text\n\"현재가 9,900(마진 5,316) / 인상가 14,900(마진 약 9,700) / 연간패키지 99,000(마진 약 74,000, 이탈률↓) 세 가지를 총마진·안정성 기준으로 비교해줘.\" → AI 응답: \"연간패키지가 건당 마진도 높고 환불·이탈 위험도 낮아 가장 안정적. 다만 초기 전환 장벽이 높으니 현재가 유지+연간 옵션 추가 병행을 고려.\"\n```\n\n> AI는 숫자 비교는 잘하지만 '어떤 게 좋은 결정인지'는 당신의 상황(브랜드 신뢰도, 고객 성향)까지 반영해 최종 판단해야 합니다.\n\n### 완성 결과\n\n한 장짜리 유닛 이코노믹스 계산표(비용 항목 5개 + 보수적 가정 + 바닥가 + 가격 시나리오 3안). 좋은 결과의 기준: (1) 비용 항목에 수수료·CAC·내 시간이 빠짐없이 들어있다 (2) 가정이 AI 기본값보다 보수적이다 (3) '더는 안 내리는 바닥가'가 숫자로 명시돼 있다.\n\n## 단계별 따라하기\n\n### 1. '한 건'에 들어가는 비용을 빠짐없이 적는다\n\n상품 하나를 팔 때 발생하는 모든 비용을 나열한다: 직접 원가(재료·외주), 결제·플랫폼 수수료, AI/도구 사용료, 예상 환불·재작업, 그 한 명을 데려온 비용(광고비/내 시간). 초보는 '수수료·내 시간·획득비'를 자주 빼먹는다 — 그게 적자의 원인.\n\n**복사·실행 예시**\n\n```text\n비용 목록(디지털 상품 1건): '플랫폼 수수료 8% / 결제 3% / AI 도구 월정액 안분 / 환불 추정 3% / 광고로 1명 데려오는 비용'\n```\n\n### 2. AI로 '한 건 마진'을 계산하되 가정을 직접 넣는다\n\nchatgpt.com이나 claude.ai에 아래 '유닛 이코노믹스' 프롬프트로 계산표를 만든다. 핵심: 환불률·전환율·내 시간당 가치 같은 '가정'을 내가 현실적으로(약간 보수적으로) 넣는다. AI의 낙관 가정을 그대로 쓰지 말 것. 합계는 사람이 검산.\n\n**복사·실행 예시**\n\n```text\n계산: '가격 10,000 −(수수료 1,100 + 도구 500 + 환불추정 300 + 획득비 2,000) = 한 건 마진 6,100'\n```\n\n### 3. '최소 남아야 하는 선'(손익분기 가격)을 구한다\n\n마진이 0이 되는 가격(이 밑으로는 팔수록 손해)을 찾는다. 그리고 내가 '한 건당 최소 얼마는 남아야' 시간·노력 값을 하는지 기준선을 정한다. 이 선이 '아무리 경쟁이 심해도 더는 안 내리는' 바닥이 된다.\n\n**복사·실행 예시**\n\n```text\n기준: '손익분기 가격 3,900원. 내 시간 값까지 보면 최소 마진 5,000원은 남아야 함 → 바닥가 8,900원'\n```\n\n### 4. AI로 가격 시나리오 3개를 비교한다(가치 기반)\n\n아래 '가격 시나리오' 프롬프트로 ①현재가 ②인상안 ③번들/연간안의 마진·필요 판매량을 비교한다. 가격은 '원가+@'가 아니라 '고객이 얻는 가치(아낀 시간·결과)'로 정하되, 3단계 바닥선을 절대 안 깬다. 인상이 무서우면 가치를 더 보여주는 쪽을 먼저 본다.\n\n**복사·실행 예시**\n\n```text\n비교: '현재 9,900(마진 6,100) vs 인상 14,900(마진 10,900) vs 연간 99,000 → 어느 쪽이 총마진·안정성 유리한지'\n```\n\n### 5. 새 가격을 정하고 '안 남는 구조'를 고친다\n\n계산을 근거로 새 가격을 정한다. 마진이 얇으면 셋 중 하나를 손본다: 가격 올리기 / 비용 줄이기(수수료 낮은 채널·도구 효율화) / 획득비 줄이기(광고 의존↓, 추천·재구매↑). '싸게 많이'의 유혹을 경계하라 — 마진 없는 매출은 빨리 망하는 길이다.\n\n**복사·실행 예시**\n\n```text\n결정: '가격 9,900→12,900 인상 + 결제 수수료 낮은 채널로 이동 + 재구매 쿠폰으로 획득비 절감'\n```\n\n## 흔한 실수와 교정\n- **실수:** 매출만 보고 '잘 된다'고 판단한다\n  - **교정:** 매출이 커도 비용 다 빼면 적자일 수 있다. '한 건 마진'을 계산해 진짜 남는지부터 봐라.\n- **실수:** 수수료·고객획득비·내 시간을 비용에서 빼먹는다\n  - **교정:** 이 셋이 초보 적자의 단골 원인. 플랫폼·결제 수수료, 광고비, 내 작업 시간 가치를 반드시 포함하라.\n- **실수:** AI의 낙관적 가정(낮은 환불률·높은 전환율)을 그대로 쓴다\n  - **교정:** 가정은 사람이 보수적으로 넣고 결과를 검산하라. 예쁜 숫자가 아니라 현실의 숫자가 필요하다.\n- **실수:** '싸게 많이 팔면 된다'며 마진 없이 단가를 낮춘다\n  - **교정:** 마진이 0 이하면 많이 팔수록 더 망한다. 바닥 가격선을 지키고, 가치로 가격을 정당화하라.\n- **실수:** 가격을 '원가+얼마'로만 정한다\n  - **교정:** 가격은 '고객이 얻는 가치'로 정하되 유닛 이코노믹스로 최소선을 지킨다. 원가 가산법은 가치를 과소평가한다.\n\n## 완료 체크리스트\n\n- '한 건'에 들어가는 모든 비용(원가·수수료·도구·환불·획득비·내 시간)을 나열했다\n- AI로 '한 건 마진'을 계산하되 가정을 보수적으로 직접 넣고 검산했다\n- 손익분기 가격과 '더는 안 내리는 바닥 가격'을 구했다\n- 가격 시나리오 3개(현재/인상/번들·연간)를 마진·필요 판매량으로 비교했다\n- 새 가격을 정하고 가격·비용·획득비 중 '안 남는 구조'를 고쳤다\n\n## 도구\n\n- ChatGPT (chatgpt.com) 또는 Claude (claude.ai) — 유닛 이코노믹스·손익분기·가격 시나리오를 빠르게 계산·비교하는 데 사용. 가정(환불률·획득비·시간 가치)은 사람이 보수적으로 넣고 합계를 검산한다.\n- 스프레드시트(구글 시트 등) — 한 건 비용·마진·시나리오를 표로 관리. 수식 결과는 직접 검산한다.\n- 주의: 세무·회계 — 정확한 원가 배분, 세금, 회계 처리는 공식 자료·전문가(세무사·회계사) 확인이 필요하다. 이 레슨의 계산은 의사결정용 추정이며 세무·회계 자문이 아니다.\n\n## 참고 답안\n\n예: 핸드메이드 비누 1개(정가 12,000원) → 비용: 재료비 3,000 + 포장 500 + 결제수수료 360 + 마켓수수료 1,200 + 환불추정(2%) 240 + CAC 1,500 = 6,800 → 마진 5,200원. 손익분기 6,800원, 시간값 고려 바닥가 9,000원. 시나리오: 현재가 12,000 vs 인상가 15,000 vs 3개 세트 32,000(마진 더 두꺼움) 비교 후 세트 구성 우선 결정."
  },
  "prompts": [
    {
      "id": "unit-economics-pricing-p1",
      "title": {
        "ko": "유닛 이코노믹스 계산표"
      },
      "template": {
        "ko": "내 상품 '한 건'의 진짜 마진을 계산하는 표를 만들어줘.\n- 판매가: [...]\n- 직접 원가: [...] / 플랫폼·결제 수수료(%): [...] / AI·도구 사용료(건당 안분): [...] / 예상 환불률(%): [...] / 고객 1명 획득비(광고/내 시간): [...]\n조건:\n1) 각 비용을 빼는 계산식을 단계별로 보여줘(내가 검산).\n2) '한 건 마진'과 '마진율(%)'을 명확히.\n3) 내가 '가정'으로 넣은 값(환불률·획득비 등)에는 [가정-검토] 표시. 낙관적으로 잡지 말 것."
      },
      "examples": [],
      "tags": [
        "eduverse",
        "unit-economics-pricing"
      ]
    },
    {
      "id": "unit-economics-pricing-p2",
      "title": {
        "ko": "손익분기 + 바닥 가격"
      },
      "template": {
        "ko": "아래 비용 구조에서 손익분기 가격(마진 0이 되는 가격)과, 내 시간 가치까지 고려한 '더는 안 내리는 바닥 가격'을 계산해줘.\n- 비용 구조: [...]\n- 내 시간당 가치(원하는 값): [...] / 한 건당 내 작업 시간: [...]\n계산식을 보여주고, '이 밑으로 팔면 손해' 선과 '최소 이만큼은 남아야' 선을 각각 1줄로 정리해줘."
      },
      "examples": [],
      "tags": [
        "eduverse",
        "unit-economics-pricing"
      ]
    },
    {
      "id": "unit-economics-pricing-p3",
      "title": {
        "ko": "가격 시나리오 3개 비교"
      },
      "template": {
        "ko": "아래 정보로 가격 시나리오 3개의 마진과 '목표 수익에 필요한 판매량'을 비교해줘.\n- 현재가·한 건 마진: [...] / 인상 후보가: [...] / 번들/연간 후보: [...] / 월 목표 수익: [...]\n표로: 가격 / 한 건 마진 / 목표 달성에 필요한 판매량 / 장단점 1줄.\n주의: 모든 가정은 보수적으로. 마지막에 '가치를 더 보여주면 인상이 가능한 근거' 1줄도."
      },
      "examples": [],
      "tags": [
        "eduverse",
        "unit-economics-pricing"
      ]
    }
  ],
  "concepts": [
    "finance",
    "literacy",
    "unit",
    "economics",
    "pricing"
  ],
  "mission": {
    "ko": "당신이 팔거나 팔고 싶은 상품/서비스 하나를 정하세요(오프라인 제품도 OK). AI에게 위 4단계 순서(비용 나열 → 보수적 가정 재계산 → 손익분기·바닥가 → 가격 시나리오 비교)를 그대로 적용해서, 당신의 유닛 이코노믹스 계산표를 만들어보세요."
  },
  "rubric": [
    {
      "criterion": {
        "ko": "내 비용 목록에 수수료·CAC·내 시간이 다 들어있나?"
      },
      "max": 5
    },
    {
      "criterion": {
        "ko": "내가 넣은 가정(환불률·전환율)이 AI 기본값보다 보수적인가, 아니면 그냥 예쁜 숫자를 믿었나?"
      },
      "max": 5
    },
    {
      "criterion": {
        "ko": "'더는 안 내리는 바닥가'가 숫자로 정해졌고, 그 밑으로는 할인 제안이 와도 거절할 수 있나?"
      },
      "max": 5
    }
  ],
  "difficulty": "pro",
  "tags": [
    "money",
    "life",
    "finance",
    "literacy"
  ],
  "estimatedMinutes": 30,
  "source": {
    "platform": "eduverse-ai.app",
    "url": "https://eduverse-ai.app/learn?course=money&node=money_unit_economics_pricing",
    "capturedAt": "2026-07-12T01:32:15.342Z",
    "captureTimeBasis": "observed",
    "method": "api-capture",
    "citation": "EduVerse verified lesson; claude-opus-4-8; prompt finance-track-v2"
  },
  "updatedAt": "2026-06-25"
}
