{
  "id": "ai-start/07-clear-one-sentence-prompt",
  "course": "ai-start",
  "order": 7,
  "title": {
    "ko": "분명하고 친절한 한 문장 명령 쓰기"
  },
  "summary": {
    "ko": "'무엇을 · 누구를 위해 · 어떤 모양으로' 세 가지를 한 문장에 담아, 막연한 명령을 또렷한 명령으로 바꿔 한 번에 쓸모 있는 답을 받는다."
  },
  "objectives": [
    {
      "ko": "또렷한 명령의 3요소(무엇을·누구를 위해·어떤 모양으로)를 안다"
    },
    {
      "ko": "막연한 명령을 또렷한 한 문장으로 고쳐 쓴다"
    },
    {
      "ko": "또렷한 명령 3개를 직접 만들어 결과를 얻는다"
    }
  ],
  "body": {
    "ko": "## 핵심 개념\n\nAI에게 부탁하는 한 문장을 '명령(프롬프트)'이라고 불러요. AI는 **친절한 식당 요리사** 같아요. '아무거나 맛있는 거 주세요'라고 하면 뭘 만들지 몰라 아무거나 내놓지만, '매운 거 싫어하는 7살 동생이 먹을, 안 매운 볶음밥 한 그릇'이라고 하면 딱 맞는 음식이 나와요. 또렷한 명령에는 세 가지가 들어가요.\n\n1. **무엇을** — 볶음밥\n2. **누구를 위해** — 7살 동생\n3. **어떤 모양으로** — 안 맵게, 한 그릇\n\n이 세 가지를 한 문장에 담으면 AI도 딱 맞는 답을 내줘요.\n\n### 또렷한 명령 한 문장의 세 가지 재료\n\n`🎯 무엇을(펭귄에 대한 신기한 사실)` + `👶 누구를 위해(우리 반 7살 동생)` + `📏 어떤 모양으로(쉬운 말로 3가지만)`\n\n### 왜 이게 될까?\n\nAI는 수억 개의 글을 배운 똑똑한 요리사지만, 손님이 '아무거나'라고 하면 헤매요. '무엇을·누구를 위해·어떤 모양으로'만 짚어주면 나머지는 AI가 알아서 채워줘요.\n\n## 👀 따라하기 예시 — 동생에게 강아지 얘기\n\n**①** 흐릿하게 '강아지 알려줘' → 백과사전처럼 길게(동생 눈높이 안 맞음)\n> 💡 세 재료가 하나도 없으니 AI가 그냥 백과사전처럼 답한다.\n\n**②** 세 재료 채우기: 무엇을=강아지 밥 주는 법 / 누구를 위해=처음 키우는 초등학생 / 어떤 모양=3단계로 쉽게\n> 💡 세 조각을 먼저 손으로 채우면 이어붙이기만 하면 된다.\n\n**③** 한 문장으로: '처음 강아지를 키우는 초등학생을 위해, 강아지 밥 주는 법을 3단계로 쉽게 알려줘' → 딱 3단계로 명확\n> 💡 세 요소가 한 문장에 다 들어가니 AI가 한 번에 딱 맞는 답을 준다.\n\n**④** '귀여운 이모지도 넣어서 다시' → 같은 대화창에 한 줄만 더\n> 💡 처음부터 다시 안 치고, 앞 내용을 기억한 채 고쳐준다.\n\n좋은 결과의 기준: (1) 세 재료가 다 들어갔나 (2) 답 길이·말투가 정한 모양대로인가 (3) 한 번에 원하던 답을 받았나.\n\n## 단계별 따라하기\n\n1. **AI 채팅 열기(계정 없이도)** — `chatgpt.com`은 로그인 없이 게스트로 열려요. 로그인 팝업이 뜨면 'Continue without logging in'. 가입 없이 완전 자유롭게 쓰려면 `duck.ai`(로그인·가입 불필요).\n2. **일부러 '흐릿한 명령'** — '동물 알려줘' → 너무 길거나 내가 원한 게 아님(흐릿한 명령의 문제).\n3. **세 재료를 종이에 적기** — ①무엇을 ②누구를 위해 ③어떤 모양으로.\n4. **한 문장으로 이어 또렷하게** — '우리 반 7살 동생에게 읽어줄, 펭귄에 대한 신기한 사실 3가지를 쉬운 말로 알려줘'.\n5. **한 가지만 더 다듬기** — '더 짧게', '더 쉬운 말로', '이모지도 넣어서' 한 줄만 이어서.\n6. **또렷한 명령 3개 직접 만들기** — 매번 세 재료가 들어갔는지 확인하며. (생일 카드 문구, 강아지 키우기, 짧은 동시 등)\n\n## 흔한 실수 → 교정\n\n- ✗ '재밌는 거 줘', '동물 알려줘' 막연 → **세 재료를 한 문장에.** '7살 동생이 웃을 짧은 수수께끼 3개'.\n- ✗ 한 문장에 너무 많이 욱여넣음 → **한 번에 한 가지 결과만.** 나머지는 다음 줄에서.\n- ✗ 답이 아쉬우면 처음부터 새로 침 → **'더 짧게' 한 줄만 더.** AI가 앞 내용을 기억한다.\n- ✗ '어떤 모양으로'(길이·말투·개수)를 빠뜨림 → **'3가지로', '쉬운 말로', '4줄로' 모양을 꼭 정한다.**\n- ✗ chatgpt.com 게스트가 자꾸 로그인 요구 → **duck.ai로 옮기거나 무료 계정 생성(둘 다 무료).**\n\n## 도구\n\n- 🛠 **ChatGPT** (chatgpt.com) — 게스트로도 시작. 자꾸 로그인 뜨면 무료 가입.\n- 🛠 **Duck.ai** (duck.ai) — 덕덕고의 무료 멀티모델 채팅. 로그인·가입·카드 불필요, 대화 미저장(프라이버시). GPT·Claude·Llama·Mistral 등 모델 선택 가능.\n- 🛠 **메모장/종이** — 세 재료 정리·명령 기록."
  },
  "prompts": [
    {
      "id": "p7-template",
      "title": {
        "ko": "기본 또렷한 명령 (만능 틀)"
      },
      "template": {
        "ko": "[누구]에게 [무엇을 할/읽을] 용으로, [주제]에 대해 [쉬운 말/재미있게]로 [개수/길이]만큼 알려줘"
      },
      "examples": [],
      "tags": [
        "프롬프트",
        "템플릿"
      ]
    },
    {
      "id": "p7-explain",
      "title": {
        "ko": "설명을 부탁할 때"
      },
      "template": {
        "ko": "[주제]를 [7살 아이/초등학생]도 이해할 수 있게, 어려운 말 없이 [3가지/5문장]로 알려줘"
      },
      "examples": [],
      "tags": [
        "프롬프트",
        "설명"
      ]
    },
    {
      "id": "p7-write",
      "title": {
        "ko": "글·문구를 써달라고 할 때"
      },
      "template": {
        "ko": "[누구]에게 줄 [생일 카드/편지/동시]를, [따뜻하게/재미있게] [4줄/5문장]으로 써줘"
      },
      "examples": [],
      "tags": [
        "프롬프트",
        "글쓰기"
      ]
    },
    {
      "id": "p7-refine",
      "title": {
        "ko": "방금 답을 더 다듬을 때"
      },
      "template": {
        "ko": "방금 답을 [더 짧게/더 쉽게/이모지 넣어서] 다시 써줘"
      },
      "examples": [],
      "tags": [
        "프롬프트",
        "수정"
      ]
    }
  ],
  "mission": {
    "ko": "이제 당신 차례! '엄마 생일에 드릴 생일 카드 문구'를 주제로 또렷한 명령을 만들어 AI 채팅(chatgpt.com 또는 duck.ai)에 넣어보세요. 무엇을·누구를 위해·어떤 모양으로 세 가지를 꼭 채워 한 문장으로."
  },
  "rubric": [
    {
      "criterion": {
        "ko": "문장에 무엇을·누구를 위해·어떤 모양으로 세 가지가 다 들어갔나"
      },
      "max": 5
    },
    {
      "criterion": {
        "ko": "한 번에 받은 답이 원하던 것과 가까웠나"
      },
      "max": 5
    },
    {
      "criterion": {
        "ko": "답이 아쉬울 때 처음부터 다시 치지 않고 한 줄로 다듬었나"
      },
      "max": 5
    }
  ],
  "difficulty": "intro",
  "tags": [
    "프롬프트 작성법",
    "명확성",
    "AI 리터러시"
  ],
  "estimatedMinutes": 15,
  "concepts": [
    "prompt",
    "specificity",
    "clarity",
    "iteration"
  ],
  "source": {
    "platform": "eduverse-ai.app",
    "url": "https://eduverse-ai.app/learn?course=ai-start",
    "method": "authenticated-crawl",
    "capturedAt": "2026-07-07T09:02:08.032Z",
    "captureTimeBasis": "file-mtime-estimate",
    "citation": "DigComp 2.2 / UNESCO Apply 단계"
  }
}
