{
  "id": "ai-finance/hire-delegate-sops",
  "course": "ai-finance",
  "order": 53,
  "title": {
    "ko": "SOP 작성·위임·외주화"
  },
  "summary": {
    "ko": "반복 업무를 표준운영절차(SOP) 문서로 만들고 프리랜서·가상비서·AI에 위임해 창업자 병목을 제거하는 위임 시스템 구축법을 가르친다."
  },
  "objectives": [
    {
      "ko": "이 레슨이 끝나면, 당신의 반복 업무 1개를 누구나 따라 할 수 있는 SOP 문서로 만들어 프리랜서·가상비서·AI에게 위임할 수 있습니다."
    }
  ],
  "body": {
    "ko": "> \"이건 나만 할 수 있어\"라고 믿는 그 업무가, 사실은 당신을 매일 3시간씩 붙잡아 두는 감옥입니다. 오늘 그 업무를 문서 한 장으로 바꿔 남에게 넘겨봅시다.\n\n## 이 레슨에서 만드는 것\n\n이 레슨이 끝나면, 당신의 반복 업무 1개를 누구나 따라 할 수 있는 SOP 문서로 만들어 프리랜서·가상비서·AI에게 위임할 수 있습니다.\n\n## 핵심 개념\n\nSOP(Standard Operating Procedure, 표준운영절차)는 \"머릿속에만 있는 일하는 방법\"을 남이 똑같이 재현할 수 있게 적어둔 설명서입니다. 창업자가 성장하지 못하는 가장 큰 이유는 능력 부족이 아니라, 모든 반복 업무가 자기 머릿속에만 있어서 아무에게도 못 넘기는 병목 현상 때문입니다. SOP는 \"결과물 사진 + 순서대로 클릭할 단계 + 하면 안 되는 것\"이라는 세 가지만 있으면 됩니다. 완벽할 필요는 없고, 남이 80%만 재현해도 성공입니다. 한번 SOP를 만들면 사람이 바뀌어도, AI에게 맡겨도 같은 품질이 나옵니다.\n\n### 왜 작동하는가\n\nAI는 이미 수많은 매뉴얼과 업무 설명서를 학습해서, \"이런 순서면 사람이 이해하기 쉽다\"는 패턴을 꿰고 있어요. 그래서 당신이 두서없이 녹화하며 중얼거린 말을 던져주기만 해도, AI가 번호 매긴 단계·준비물·주의사항으로 착착 정리해 줍니다. 즉 당신은 \"직접 해보며 설명\"만 하면, \"보기 좋게 문서로 다듬기\"는 AI가 대신 해주는 거예요.\n\n## 👀 따라하기 예시\n\n매주 인스타 게시물을 예약 업로드하는 업무를 SOP로 만드는 상황이에요. 제가 먼저 처음부터 끝까지 해볼게요, 눈으로 따라오세요.\n\n### 1. ① 화면 녹화하며 실제로 업무 수행 + 말로 설명\n\n**실제 결과**\n\n```text\n(녹화 음성 그대로) \"메타 비즈니스 스위트 접속 → 계획 탭 클릭 → 게시물 만들기 → 사진은 캔바 폴더 이번주에서 → 캡션은 노션 캡션표 맨 위 행 복사 → 예약 오전 8시 설정 → 게시\"\n```\n\n> 완벽한 글이 아니라 \"말한 그대로\"를 남겨야, 다음 단계에서 AI가 진짜 동작 순서를 놓치지 않아요.\n\n### 2. ② 녹화 대본을 그대로 AI에게 붙여넣고 SOP 정리 요청\n\n**실제 결과**\n\n```text\n\"[SOP] 주간 인스타 예약 업로드 / 소요 15분 / 준비물: 캔바 접근권, 노션 캡션표 / 1. 메타 비즈니스 스위트 로그인 2. 계획 탭 → 게시물 만들기 3. 캔바 폴더 이번주 사진 첨부 4. 노션 캡션표 상단 행 복사해 캡션란에 붙여넣기 5. 예약 시간 오전 8시로 설정 6. 예약 확인 스크린샷을 팀 채널에 공유 / 주의: 오전 8시 이외 시간 금지, 해시태그 30개 초과 금지\"\n```\n\n> AI는 두서없는 말도 \"번호+준비물+주의사항\" 틀에 자동으로 맞춰줘요. 이게 진짜 아하 포인트예요.\n\n### 3. ③ 예전 실수 지점·합격 기준을 손으로 추가\n\n**실제 결과**\n\n```text\n\"⚠️체크포인트: 예약 시간이 오전 8시 맞는지 예약 목록에서 눈으로 재확인 / ✅합격 기준: 이번 주 5개 게시물이 모두 예약됨 상태, 오타·깨진 이미지 0개\"\n```\n\n> AI는 당신이 과거에 겪은 실수를 모르기 때문에, 이 부분만큼은 사람이 채워줘야 진짜 쓸모 있는 문서가 돼요.\n\n### 4. ④ 노션 문서로 만들어 위임 대상에게 전달\n\n**실제 결과**\n\n```text\n위임 메시지: \"이 SOP대로 매주 월요일 오전까지 예약해 주세요. 완료되면 예약 목록 스크린샷을 보내주세요. 첫 2주는 게시 전 저에게 확인받아 주세요.\"\n```\n\n> 완성된 SOP도 처음엔 100%가 아니에요. \"확인받는 기간\"을 넣어야 실전에서 안전하게 넘길 수 있어요.\n\n### 완성 결과\n\n완성물: 준비물·번호 단계·주의사항·합격 기준이 모두 담긴 A4 1장 분량의 SOP 문서. 좋은 결과의 기준 — (1) 처음 보는 사람이 질문 없이 80% 따라 할 수 있다 (2) 합격 기준 한 줄이 명확하다 (3) 실수했던 지점에 경고 표시가 있다.\n\n## 단계별 따라하기\n\n### 1단계 — 위임할 반복 업무 1개 고르기 (5분) 🙋나\n\n지난 일주일 동안 2번 이상 반복했고, 매번 비슷한 방식으로 처리한 업무를 종이나 메모앱에 5개 적으세요. 그중 (1) 창의성이 거의 필요 없고 (2) 실수해도 회사가 망하지 않으며 (3) 시간을 가장 많이 잡아먹는 것 1개에 동그라미 치세요. 이게 첫 SOP 대상입니다.\n\n**복사·실행 예시**\n\n```text\n후보: ①인스타 게시물 예약 업로드 ②고객 문의 1차 답변 ③주문 엑셀 정리 ④세금계산서 발행 ⑤경쟁사 가격 체크 → 동그라미: ①인스타 게시물 예약 업로드 (매주 5회, 회당 20분)\n```\n\n### 2단계 — 실제로 한 번 하면서 화면 녹화하기 (15분) 🙋나\n\n고른 업무를 지금 실제로 처음부터 끝까지 한 번 수행하되, 화면 녹화를 켜고 말로 설명하며 진행하세요. 맥은 QuickTime(⌘+⌃+5), 윈도우는 Win+G, 웹은 Loom을 쓰면 됩니다. 클릭하는 모든 버튼과 입력하는 값을 소리 내어 말하는 것이 핵심입니다.\n\n**복사·실행 예시**\n\n```text\n녹화하며 말하기: \"메타 비즈니스 스위트 접속 → 계획 탭 클릭 → 게시물 만들기 → 사진은 캔바 폴더 이번주에서 → 캡션은 노션 캡션표 맨 위 행 복사 → 예약을 오전 8시로 설정 → 게시\"\n```\n\n### 3단계 — AI에게 녹화 설명을 SOP 문서로 정리시키기 (10분) 🤝함께\n\n녹화하며 말한 내용을 그대로 타이핑하거나 자동 자막을 복사해서, 아래 첫 번째 템플릿에 붙여넣고 ChatGPT·Claude에 보내세요. AI가 번호 매긴 단계·주의사항·소요시간을 갖춘 SOP 초안을 만들어 줍니다.\n\n**복사·실행 예시**\n\n```text\nAI 출력: \"[SOP] 주간 인스타 예약 업로드 / 소요 15분 / 준비물: 캔바 접근권, 노션 캡션표 / 1. 메타 비즈니스 스위트 로그인 … 6. 예약 확인 스크린샷을 팀 채널에 올리기 / 주의: 오전 8시 이외 시간 금지, 해시태그 30개 초과 금지\"\n```\n\n### 4단계 — 실수 방지용 체크포인트·합격 기준 추가하기 (10분) 🙋나\n\nAI 초안을 읽으며 (1) 예전에 실수했던 지점 (2) 반드시 확인해야 넘어가는 관문 (3) 완료의 정의를 손으로 추가하세요. 특히 결과물이 합격인지 아닌지 판단하는 기준 한 줄을 꼭 넣어야 위임받은 사람이 스스로 검수합니다.\n\n**복사·실행 예시**\n\n```text\n추가한 항목: \"⚠️체크포인트: 예약 시간이 오전 8시가 맞는지 예약 목록에서 눈으로 재확인 / ✅합격 기준: 이번 주 5개 게시물이 모두 예약됨 상태로 뜨고, 오타·깨진 이미지 0개면 완료\"\n```\n\n### 5단계 — 실제 위임 대상 정하고 넘기기 (10분) 🙋나\n\nSOP를 넘길 대상을 정하세요. 판단이 거의 없으면 AI/자동화, 사람 손이 필요하면 가상비서·프리랜서입니다. 노션·구글 문서로 SOP 링크를 만들고, 두 번째 템플릿으로 위임 메시지를 작성해 전달하세요. 첫 회는 결과물만 검수하겠다고 명시하세요.\n\n**복사·실행 예시**\n\n```text\n결정: 판단 거의 없음 → 크몽·숨고에서 SNS 관리 가상비서 시급제 채용. 위임 메시지: \"이 SOP대로 매주 월요일 오전까지 예약해 주세요. 완료되면 예약 목록 스크린샷을 보내주세요. 첫 2주는 게시 전 저에게 확인받아 주세요.\"\n```\n\n### 6단계 — 1회 실행 후 SOP 구멍 메우기 (10분) 🤝함께\n\n위임받은 사람(또는 AI)이 처음 실행한 뒤 나온 질문·실수를 모으세요. 질문이 나왔다는 건 SOP에 빠진 정보가 있다는 신호입니다. 그 질문에 대한 답을 SOP 해당 단계에 바로 추가해 v2로 갱신하면, 다음부터는 같은 질문이 사라집니다.\n\n**복사·실행 예시**\n\n```text\n받은 질문: \"캡션표에서 어느 행을 써야 하나요?\" → SOP 3단계에 \"항상 상태 열이 대기중인 맨 위 행 사용, 사용 후 게시됨으로 변경\" 문장 추가 → v2 저장\n```\n\n## 흔한 실수와 교정\n- **실수:** 완벽한 SOP를 만들려고 며칠을 붙잡고 결국 위임을 못 한다.\n  - **교정:** SOP는 80% 재현이면 합격이다. 화면 녹화 15분 + AI 정리 10분으로 초안을 만들고, 나머지 20%는 위임받은 사람의 질문으로 채워라(6단계). 완성은 사용하면서 이뤄진다.\n- **실수:** 합격 기준을 안 적어서, 위임받은 사람이 매번 나에게 이게 맞냐고 물어본다.\n  - **교정:** 모든 SOP 끝에 ✅합격 기준 한 줄을 반드시 넣어라. 예: 오타 0개·이미지 정상·예약 시간 8시. 스스로 검수할 기준이 있어야 진짜 위임이 된다.\n- **실수:** 판단이 많이 필요한 핵심 업무부터 위임하려다 사고가 나고 위임을 포기한다.\n  - **교정:** 첫 SOP는 실수해도 회사가 안 망하는 저위험·고반복 업무로 시작하라(1단계 기준). 위임 근육이 붙은 뒤에 점점 중요한 업무로 확장하라.\n\n## 완료 체크리스트\n\n- 위임할 반복 업무 1개를 저위험·고반복 기준으로 골랐다\n- 실제 수행을 화면 녹화하며 클릭·입력을 말로 설명했다\n- AI로 녹화 내용을 번호 매긴 SOP 초안으로 정리했다\n- ⚠️주의사항과 ✅합격 기준 한 줄을 직접 추가했다\n- 위임 대상(사람/AI)을 정하고 위임 메시지와 함께 SOP를 넘겼다\n\n## 도구\n\n- Loom (loom.com) — 웹 업무 화면 녹화·자동 자막으로 SOP 원본 만들기\n- 노션 (notion.so) — SOP 문서 보관·링크 공유·버전 관리\n- 크몽 (kmong.com) — 가상비서·프리랜서 위임 대상 채용\n- Zapier (zapier.com) — 판단 없는 반복 업무를 사람 없이 자동화\n\n## 참고 답안\n\n예시 흐름: 5줄로 순서 적기 → AI에게 붙여넣고 SOP 요청 → AI가 준 초안에서 내가 실수했던 지점 1개 추가 → 합격 기준 한 줄 추가 → 노션/구글문서에 저장"
  },
  "prompts": [
    {
      "id": "hire-delegate-sops-p1",
      "title": {
        "ko": "① 녹화 설명 → SOP 문서 자동 정리 (가장 먼저 쓰세요)"
      },
      "template": {
        "ko": "너는 업무 표준화 전문가야. 아래는 내가 [업무이름] 작업을 실제로 하면서 말로 설명한 내용이야. 이걸 초보자도 그대로 따라 할 수 있는 SOP 문서로 정리해줘.\n\n형식: (1)업무명·소요시간·준비물 (2)번호 매긴 실행 단계 — 각 단계에 무엇을 클릭/입력하는지 구체적으로 (3)⚠️주의사항 3개 (4)✅합격 기준 한 줄. 모호한 표현 없이 명령형으로.\n\n[여기에 녹화하며 말한 내용 붙여넣기]"
      },
      "examples": [],
      "tags": [
        "eduverse",
        "hire-delegate-sops"
      ]
    },
    {
      "id": "hire-delegate-sops-p2",
      "title": {
        "ko": "② 위임 메시지 작성 (프리랜서·가상비서에게)"
      },
      "template": {
        "ko": "아래 SOP를 [가상비서/프리랜서]에게 처음 위임하려고 해. 정중하지만 명확한 위임 메시지를 써줘. 포함할 것: 무엇을·언제까지·완료 증거로 무엇을 보낼지·첫 몇 회는 검수받을 것·질문 환영한다는 말. 너무 길지 않게.\n\nSOP: [SOP 내용 붙여넣기]\n마감: [예: 매주 월요일 오전 10시]"
      },
      "examples": [],
      "tags": [
        "eduverse",
        "hire-delegate-sops"
      ]
    },
    {
      "id": "hire-delegate-sops-p3",
      "title": {
        "ko": "③ 이 업무를 AI/자동화에 맡길 수 있는지 진단"
      },
      "template": {
        "ko": "다음 반복 업무를 사람에게 맡길지, AI·자동화 도구에 맡길지 판단해줘. 판단이 필요한 부분과 단순 반복인 부분을 나눠서 표로 정리하고, 자동화 가능하면 어떤 도구(Zapier/Make/ChatGPT 등)로 어떻게 구성할지 제안해줘.\n\n업무 설명: [업무를 3~5문장으로]"
      },
      "examples": [],
      "tags": [
        "eduverse",
        "hire-delegate-sops"
      ]
    },
    {
      "id": "hire-delegate-sops-p4",
      "title": {
        "ko": "④ 여러 SOP를 위임 매뉴얼로 묶기"
      },
      "template": {
        "ko": "아래 여러 개의 SOP를 신입/가상비서가 첫날 읽을 수 있는 하나의 온보딩 매뉴얼 목차로 묶어줘. 우선순위 순서로 정렬하고, 각 SOP마다 한 줄 요약과 예상 학습 시간을 붙여줘.\n\nSOP 목록: [SOP 제목들 나열]"
      },
      "examples": [],
      "tags": [
        "eduverse",
        "hire-delegate-sops"
      ]
    }
  ],
  "concepts": [
    "hire",
    "delegate",
    "sops"
  ],
  "mission": {
    "ko": "당신이 지난주 2번 이상 반복한 업무 중 \"고객 문의 1차 답변\" 또는 \"주문 엑셀 정리\" 하나를 골라, 화면 녹화 없이 말로 순서를 적어보고(5줄 정도) AI에게 \"이걸 SOP로 정리해줘\"라고 요청해 보세요."
  },
  "rubric": [
    {
      "criterion": {
        "ko": "내 SOP에 준비물·번호 단계·주의사항이 다 들어있나요?"
      },
      "max": 5
    },
    {
      "criterion": {
        "ko": "합격 기준(완료의 정의) 한 줄이 명확한가요?"
      },
      "max": 5
    },
    {
      "criterion": {
        "ko": "이 문서만 보고 남이 질문 없이 80% 따라 할 수 있을까요?"
      },
      "max": 5
    }
  ],
  "difficulty": "pro",
  "tags": [
    "Applied-AI",
    "academic"
  ],
  "estimatedMinutes": 36,
  "source": {
    "platform": "eduverse-ai.app",
    "url": "https://eduverse-ai.app/learn?course=money&node=moneyx_hire_delegate_sops",
    "capturedAt": "2026-07-12T01:32:15.342Z",
    "captureTimeBasis": "observed",
    "method": "api-capture",
    "citation": "EduVerse verified lesson; claude-opus-4-8; prompt ai-lesson-v3-agent"
  },
  "updatedAt": "2026-07-03"
}
