{
  "id": "ai-finance/data-research-products",
  "course": "ai-finance",
  "order": 35,
  "title": {
    "ko": "AI로 데이터·리서치 판매하기"
  },
  "summary": {
    "ko": "흩어진 공개 정보를 모아 '바로 쓸 수 있게' 정리한 데이터셋·리서치 리포트·인사이트 뉴스레터를 상품화한다. AI로 수집·요약·구조화를 가속하되, 출처·사실·라이선스를 사람이 검증·표기한다(허락 없는 스크래핑·재판매 금지). 무료 샘플로 신뢰를 보이고 유료 구독으로 잇는 모델을 익힌다."
  },
  "objectives": [
    {
      "ko": "흩어진 공개 정보를 '바로 쓸 수 있게' 정리한 데이터셋·리서치 리포트·인사이트 뉴스레터 중 하나를 정하고, AI로 수집·요약·구조화를 가속하되 출처·사실·라이선스를 사람이 검증·표기해, 무료 샘플→유료 구독 모델과 한 장 기획서까지 완성한다."
    }
  ],
  "body": {
    "ko": "> 인터넷에 흩어진 정보를 '바로 쓸 수 있게' 모아주는 것만으로도 돈이 된다. 사람들은 '찾고 정리하는 시간'을 사니까. 오늘 데이터·리서치 상품 1개를 윤리적으로 설계한다.\n\n## 이 레슨에서 만드는 것\n\n흩어진 공개 정보를 '바로 쓸 수 있게' 정리한 데이터셋·리서치 리포트·인사이트 뉴스레터 중 하나를 정하고, AI로 수집·요약·구조화를 가속하되 출처·사실·라이선스를 사람이 검증·표기해, 무료 샘플→유료 구독 모델과 한 장 기획서까지 완성한다.\n\n## 핵심 개념\n\n데이터·리서치 상품의 가치는 '정보 자체'가 아니라 '흩어진 걸 찾고 검증하고 바로 쓰게 정리한 시간'이다. 사람들은 '내가 직접 하면 5시간 걸릴 일'을 대신 해준 묶음에 기꺼이 돈을 낸다 — 정리된 데이터셋, 한눈에 보는 리서치 리포트, 매주 핵심만 추리는 인사이트 뉴스레터가 대표적이다. AI는 여기서 수집·요약·구조화·번역을 엄청나게 가속한다. 하지만 이 상품의 '신뢰'는 정확성에서 나오고, 그건 사람만 보증할 수 있다: AI가 지어낸(환각) 숫자·출처·인용을 그대로 팔면 단 한 번에 평판이 무너진다. 그래서 '출처 표기 + 1차 자료 교차검증'이 상품의 핵심 가치다. 윤리·법규도 결정적이다: 공개된 정보라도 '허락 없는 대량 스크래핑'이나 '저작권 있는 자료 재판매'는 위반이 될 수 있고, 출처의 이용약관·저작권을 반드시 확인한다. 판매는 '무료 샘플로 정확성과 유용성을 먼저 증명'하고 유료 구독으로 잇는 게 정석이다.\n\n### 왜 작동하는가\n\nAI는 인터넷에 흩어진 자료를 순식간에 긁어모아 표·항목으로 정리해줍니다. 그래서 당신은 '무엇을 모을지, 어디까지 믿을지'만 정하면 되고, 지루한 수집·1차 정리는 AI가 대신 해줍니다. 다만 AI가 채운 숫자와 출처는 항상 초안일 뿐이라, 사람이 원문과 대조해 검증해야 진짜 상품이 됩니다.\n\n## 👀 따라하기 예시\n\n소상공인 지원사업 정보 — 매주 흩어진 공고를 모아 마감일·대상별로 정리하는 뉴스레터를 만든다고 해볼게요. 제가 먼저 처음부터 끝까지 해볼게요, 눈으로 따라오세요.\n\n### 1. ① AI에게 원자료를 표로 구조화시킨다\n\n**실제 결과**\n\n```text\n\"공고명 | 대상 | 지원금 | 마감일 | 출처 링크\" 표. 예: 청년창업 지원 | 만39세 이하 | 최대 500만원[검증 필요] | 7/20 | (링크)\n```\n\n> AI는 정리는 잘하지만 숫자를 지어낼 수 있어요. 그래서 [검증 필요] 표시를 꼭 남겨둡니다 — 이게 다음 단계의 신호등이에요.\n\n### 2. ② 1차 출처와 하나씩 대조한다\n\n**실제 결과**\n\n```text\n공식 공고 원문 확인 결과: '최대 500만원' → 실제는 '최대 300만원'. 표를 정정하고 공식 링크를 붙임\n```\n\n> 바로 이 대조가 상품의 진짜 가치예요. AI가 아니라 사람이 확인했다는 증거가 신뢰를 만듭니다.\n\n### 3. ③ 이용약관·저작권을 확인한다\n\n**실제 결과**\n\n```text\n해당 사이트는 공공기관 공고라 요약·링크 안내는 허용, 원문 전체 복제는 비허용 확인 → 요약형으로 재정리\n```\n\n> 공개 정보라도 약관을 넘으면 위반이에요. 확인 한 번이 나중의 큰 사고를 막아줍니다.\n\n### 4. ④ 이번 주 5건만 골라 무료 샘플로 공개한다\n\n**실제 결과**\n\n```text\n'이번 주 지원사업 5건 무료 공개 — 전체·과거 아카이브·마감 알림은 유료 구독' 안내문 완성\n```\n\n> 무료 샘플에서 틀리면 유료 전환은 없어요. 그래서 가장 꼼꼼히 검증한 5건만 먼저 보여주는 거예요.\n\n### 완성 결과\n\n완성물: 출처 링크가 달린 검증된 지원사업 정리표 + 무료 샘플 안내문. 좋은 결과의 기준 — (1) 모든 숫자·날짜에 1차 출처 링크가 달려 있다 (2) AI 초안과 사람 검증 결과가 다른 부분이 실제로 정정되어 있다 (3) 무료 샘플만 봐도 '이 사람 정확하다'는 확신이 든다.\n\n## 단계별 따라하기\n\n### 1. '누가 찾기 귀찮아하는 정보'인지 정한다\n\n특정 대상이 '매번 흩어진 걸 모으느라 시간 쓰는' 주제를 고른다. 그리고 형태를 정한다: 한 번 정리한 데이터셋 / 깊이 있는 리서치 리포트 / 매주 추리는 뉴스레터. 좁은 주제일수록(예: '국내 채식 식당 신규 오픈') 정리 가치가 크다.\n\n**복사·실행 예시**\n\n```text\n결정: '소상공인 지원사업 정보 — 매주 흩어진 공고를 마감일·대상별로 정리한 뉴스레터'\n```\n\n### 2. AI로 수집·요약·구조화를 '가속'한다(검증 전 단계)\n\nchatgpt.com이나 claude.ai에 아래 '구조화' 프롬프트로, 모은 원자료를 '대상이 바로 쓰게' 표·항목으로 정리시킨다. 핵심: 이 단계 결과는 '초안'일 뿐. AI가 채운 숫자·날짜·출처는 다음 단계에서 사람이 전부 검증한다. 자동 수집은 출처의 약관 허용 범위 안에서만.\n\n**복사·실행 예시**\n\n```text\n구조화: '공고명 / 대상 / 지원금 / 마감일 / 출처 링크' 표로 — 날짜·금액은 [검증 필요] 표시\n```\n\n### 3. 출처·사실·라이선스를 사람이 검증·표기한다\n\n이게 상품의 진짜 가치다. AI가 만든 항목을 1차 출처(공식 사이트·원문)와 하나씩 대조해 숫자·날짜·인용을 확인하고, 각 항목에 출처 링크를 단다. 동시에 그 자료를 재정리·판매해도 되는지 이용약관·저작권을 확인한다(안 되면 요약·링크 안내 방식으로).\n\n**복사·실행 예시**\n\n```text\n검증: 'AI가 적은 지원금 '최대 500만원'을 공식 공고에서 확인 → 실제 '최대 300만원'으로 정정, 링크 첨부'\n```\n\n### 4. '무료 샘플'로 정확성과 유용성을 먼저 증명한다\n\n전체의 일부(예: 이번 주치 5건)를 무료 샘플로 공개해, '이 사람은 정확하고 시간 아껴준다'를 증명한다. 신뢰가 쌓여야 유료 구독이 일어난다. 무료에서 사실 오류가 나오면 끝장이니, 샘플일수록 더 꼼꼼히 검증한다.\n\n**복사·실행 예시**\n\n```text\n샘플: '이번 주 지원사업 5건 무료 공개 → 전체·과거 아카이브·마감 알림은 유료 구독'\n```\n\n### 5. 유료 구독 모델 + 한 장 기획서로 마무리한다\n\n아래 '기획서' 프롬프트로 대상/제공 형태/업데이트 주기/가격/출처 정책을 한 장에 정리한다. 구독은 '반복 필요'가 있을 때 강하다(매주 갱신 정보). 마지막에 윤리·법규 점검: 출처 표기, 약관·저작권 준수, '틀리면 정정·환불' 정책을 명시한다.\n\n**복사·실행 예시**\n\n```text\n기획서 끝줄: '모든 항목 출처 링크 표기, 공식 공고 기준, 오류 발견 시 정정 공지 + 해당 호 환불'\n```\n\n## 흔한 실수와 교정\n- **실수:** AI가 정리한 숫자·출처를 검증 없이 그대로 판다\n  - **교정:** 환각 1건이 평판을 끝낸다. 모든 숫자·날짜·인용을 1차 출처와 대조해 검증하고 출처 링크를 달아라.\n- **실수:** 허락 없이 대량 스크래핑하거나 저작권 자료를 재판매한다\n  - **교정:** 공개 정보라도 출처의 이용약관·저작권을 어기면 위반이다. 약관을 확인하고, 안 되면 요약·링크 안내 방식으로.\n- **실수:** 무료 샘플을 대충 만들어 사실 오류가 난다\n  - **교정:** 무료에서 틀리면 유료 전환은 없다. 샘플일수록 더 꼼꼼히 검증해 '정확함'을 증명하라.\n- **실수:** 상충하는 자료를 한쪽으로 단정해 정리한다\n  - **교정:** 상반된 내용은 '상충'으로 그대로 보여주는 게 더 신뢰를 준다. 단정은 신뢰를 깎는다.\n- **실수:** 정정·환불 정책 없이 '완벽'인 척한다\n  - **교정:** 오류는 생긴다. '틀리면 정정 공지 + 해당 호 환불' 정책을 미리 밝히는 게 오히려 신뢰를 키운다.\n\n## 완료 체크리스트\n\n- '누가 찾기 귀찮아하는 정보'와 형태(데이터셋/리포트/뉴스레터)를 정했다\n- AI로 원자료 수집·요약·구조화를 가속했다(검증 전 초안)\n- 모든 숫자·날짜·인용을 1차 출처로 검증하고 출처 링크를 달았다\n- 자료의 이용약관·저작권을 확인해 재정리·판매 가능 여부를 점검했다\n- 무료 샘플→유료 구독 모델과 한 장 기획서, 정정·환불 정책을 완성했다\n\n## 도구\n\n- ChatGPT (chatgpt.com) 또는 Claude (claude.ai) — 원자료 수집·요약·구조화·번역을 가속하는 데 사용. 숫자·출처·인용은 반드시 사람이 1차 자료로 검증한다(환각 주의).\n- 스프레드시트(구글 시트 등) — 데이터셋·리포트를 표로 정리하고 출처 링크를 관리하는 데 사용.\n- 뉴스레터/구독 도구 (예: 이메일 발송 서비스) — 무료 샘플과 유료 구독을 운영하는 채널. 발송 한도·결제·정산은 각 서비스 약관 확인.\n- 주의: 출처의 이용약관·저작권 — 허락 없는 대량 스크래핑·재판매는 위반이 될 수 있으므로 반드시 확인하고, 불확실하면 요약·링크 안내 방식으로 한다.\n\n## 참고 답안\n\n① AI 초안: \"식당명 | 위치 | 오픈일 | 메뉴특징 | 출처 링크\" 표 생성, 불확실한 오픈일엔 [검증 필요] 표시 → ② 각 식당 SNS·지도 앱 원문과 대조해 오픈일·주소 정정, 링크 첨부 → ③ 지도 앱 정보는 출처 표기 시 인용 가능함을 확인 → ④ \"이번 달 신규 채식 식당 3곳 무료 공개, 전체 아카이브는 유료 구독\" 안내문 작성"
  },
  "prompts": [
    {
      "id": "data-research-products-p1",
      "title": {
        "ko": "원자료 구조화 (바로 쓰게 정리)"
      },
      "template": {
        "ko": "아래 원자료를 [대상]이 바로 쓸 수 있게 표로 구조화해줘.\n- 대상: [...] / 주제: [...]\n- 원자료(붙여넣기): [...]\n조건:\n1) 열은 [대상]에게 가장 중요한 항목 위주로(예: 이름/대상/금액/마감일/출처).\n2) 내가 '1차 출처로 반드시 검증'해야 할 숫자·날짜·인용에는 [검증 필요] 표시.\n3) 출처가 불명확한 항목은 지어내지 말고 '출처 미확인'이라고 적어줘."
      },
      "examples": [],
      "tags": [
        "eduverse",
        "data-research-products"
      ]
    },
    {
      "id": "data-research-products-p2",
      "title": {
        "ko": "리서치 요약 (출처 보존)"
      },
      "template": {
        "ko": "아래 자료들을 [대상]을 위한 짧은 리서치 요약으로 정리해줘.\n- 자료/링크: [...]\n조건:\n1) 핵심 결론 3~5개를 불릿으로, 각 결론 옆에 '어느 자료에서 나왔는지' 표시.\n2) 자료 간 상충하는 내용이 있으면 '상충' 으로 따로 표시(한쪽으로 단정 금지).\n3) 원문에 없는 수치·주장은 절대 추가하지 말 것. 모르면 '자료에 없음'."
      },
      "examples": [],
      "tags": [
        "eduverse",
        "data-research-products"
      ]
    },
    {
      "id": "data-research-products-p3",
      "title": {
        "ko": "데이터·리서치 상품 한 장 기획서"
      },
      "template": {
        "ko": "내 데이터/리서치 상품의 한 장 기획서를 만들어줘.\n- 주제·형태(데이터셋/리포트/뉴스레터): [...] / 대상: [...] / 업데이트 주기: [...] / 가격: [...]\n구성: ①누구에게+어떤 시간을 아껴주나 ②제공 형태·주기 ③무료 샘플 ④유료 구독 ⑤출처·정확성 정책(출처 표기/정정·환불) ⑥지켜야 할 약관·저작권 체크 3가지.\n과장 금지, 정확성·신뢰를 핵심 가치로."
      },
      "examples": [],
      "tags": [
        "eduverse",
        "data-research-products"
      ]
    }
  ],
  "concepts": [
    "finance",
    "literacy",
    "verification",
    "data",
    "research",
    "products"
  ],
  "mission": {
    "ko": "이번엔 주제를 바꿔서 해보세요: '우리 동네 신규 오픈 채식 식당 정보'를 모으는 리서치 리포트를 만든다고 하고, ①AI로 표 구조화 → ②출처 대조 검증 → ③약관 확인 → ④무료 샘플 안내문까지 직접 써보세요."
  },
  "rubric": [
    {
      "criterion": {
        "ko": "내가 정리한 정보 중 AI가 채운 값을 원문과 실제로 하나하나 대조했는가?"
      },
      "max": 5
    },
    {
      "criterion": {
        "ko": "출처 링크 없이 남아있는 항목이 하나라도 있는가?"
      },
      "max": 5
    },
    {
      "criterion": {
        "ko": "이 자료를 재정리해서 파는 게 원출처의 이용약관·저작권에 어긋나지 않는지 확인했는가?"
      },
      "max": 5
    }
  ],
  "difficulty": "advanced",
  "tags": [
    "money",
    "life",
    "finance",
    "literacy",
    "verification"
  ],
  "estimatedMinutes": 30,
  "source": {
    "platform": "eduverse-ai.app",
    "url": "https://eduverse-ai.app/learn?course=money&node=money_data_research_products",
    "capturedAt": "2026-07-12T01:32:15.342Z",
    "captureTimeBasis": "observed",
    "method": "api-capture",
    "citation": "EduVerse verified lesson; claude-opus-4-8; prompt finance-track-v2"
  },
  "updatedAt": "2026-06-25"
}
